11/3/2022 12:23:04,A-I,21,Male,"5'10""",Yes,Asian,2nd generation,1,1,,1,2,Southern California,Senior,No,CS,3.5 - 4.0,16,176,CS105,"AP Comp Sci A, AP Calculus AB",Yes,3,1st/2nd year of High School,Yes,Java,A,A,Software,Web Development,2nd generation (parents attended college),Masters,"Parents, Money",Yes,Laptop/PC,Only when necessary,7,7,3,"Afraid of public speaking, Anxious about getting judged by your peers for an incorrect answer or “bad” question, Okay with participating in class if it is a requirement",3,0.5,2,10,N/A,No,N/A,No,0,No,No,50k - 150k,"$75,000",On Campus,Walk,Yes,2,"Entrees, Snacks, Desserts, Fruits/Salads",Lack of options,0,0,0,0,0,No,"Basketball, Soccer",2,25,3,0,3,4,20,5,3,"MOBA, FPS, Single Player Games, Co-op Games, RTS",Europa Universalis 4,Yes,5,3,6,4,4,Less than a month ago,Academics,"Food, Watching Netflix",No,Binging,Independent,4,2,2,Not Sure,Yes,Not Sure,"Movies, Video Games, Board Games / Card Games, Sports / Physical Activity",30,12,0,0,Soda,,0,1,"Sports, General News & Current Affairs, Entertainment, Art & Culture",Windows,Piano,2,New Balance,In-N-Out,Apple,Coca Cola,Spotify,Text your parents that you will be home later,Wait until someone approaches you,Your self-confidence tanks,Google it
11/3/2022 12:38:43,A-I,21,Male,6 Feet 0 inches,Yes,Asian,2nd generation,0,N/A,2,1,2,Southern California,Senior,No,Computer Science,3.5 - 4.0,20,141.5,CS105,AP Calculus AB,Yes,2,Middle School or earlier,No,,A,A,Software,Web Development,2nd generation (parents attended college),High school,"Passion, Money",No,Paper & Pen,Most of the time (51% - 99%),11,11,2,"Afraid of public speaking, Anxious about getting judged by your peers for an incorrect answer or “bad” question",1,0,4,45,N/A,No,N/A,No,0,No,Yes,50k - 150k,"$100,000",Off-Campus (31+ -mile radius),Drive Yourself,No,4,Entrees,Financial issues,0,0,3,1,0,No,,1,84 (youtube constantly playing),1,0,84 (youtube),3,84,4,2,"MOBA, FPS, Fighting Games, Gatcha, Rhythm Games",Fate/Grand Order,Yes,2,1,5,5,5,Less than a week ago,Academics,Watching Netflix,Yes,"Neither, still in lots of pain",None,2,2,3,Not Sure,Not Sure,Yes,"Visual Arts (painting, drawing, knitting, etc.), Music (instrument, singing, composing, etc.), Learning a language, Reading, Movies, Video Games, Board Games / Card Games",56,4,1,0,Soda,None,0,0,None,Windows,"Strings, Wind Instruments",12,No Preference,In-N-Out,Samsung,Dr. Pepper,Youtube,Text your parents that you will be home later,Wait until someone approaches you,Your self-confidence tanks,Ask a classmate/friend
11/3/2022 13:47:40,J-R,21,Male,6ft,Yes,Asian,1st generation,2,1,3,2,3,Southern California,Senior,No,CS,3.0 - 3.49,18,240,CS105,"AP Comp Sci A, AP Calculus AB",Yes,3,After High School,Yes,Java,A,A,Hardware,Video Game Development,1st generation (first to attend),Bachelors,"Parents, Passion, Money, Status",No,Paper & Pen,Most of the time (51% - 99%),10,10,3,"Afraid of public speaking, Anxious about getting judged by your peers for an incorrect answer or “bad” question, Okay with participating in class if it is a requirement",4,4,15,20,N/A,No,N/A,No,0,No,No,50k - 150k,$100 000,Off-Campus (4-30 mile radius),Drive Yourself,No,3,Entrees,Not hungry,0,0,0,0,0,No,Tack and Field,3,8,0,0,3,3,3,5,0,"MOBA, Gatcha, Co-op Games",Genshin,Yes,0,3,5,5,4,Been a while,Self agony,N/A,No,Sleep,None,5,3,3,Yes,Not Sure,Not Sure,"Movies, Video Games, Board Games / Card Games, Cooking, Sports / Physical Activity, I don't have a hobby",8,3,0,0,Energy Drinks,None,0,8,"Computers, Science & Technology",Windows,"Strings, Piano, Wind Instruments",5,Nike,In-N-Out,Apple,Sprite,Spotify,Text your parents that you will be home later,Find a group of people and talk to them,Take the criticism and think about the issues,Ask a TA and/or professor
11/3/2022 14:38:13,S-Z,22,Female,"5'7""",Yes,White,1st generation,1,1,4,2,2,International,Senior,No,CS,3.0 - 3.49,12,170,CS105,AP Calculus BC,Yes,4,3rd/4th year of High School,No,N/A,A,A,Software,Hardware,4 or more generations (great grandparents attended college),Bachelors,Parents,Yes,Paper & Pen,Only when necessary,5,5,3,"Afraid of public speaking, Okay with participating in class if it is a requirement",3,1,18,10,1 offer in Summer 2022,No,N/A,No,N/A,No,No,50k - 150k,"$90,000",On Campus,Walk,Yes,2,"Snacks, Juice/Tea/Coffee",Expensive compared to other options,,0,N/a,N/A,N/A,No,,3,1,1,0,1,3,1,N/A,N/A,,N/A,Yes,3,3,7,4,5,Been a while,Self agony,"Food, Reading Books",Yes,Friends & Family,None,3,2,2,No,No,Yes,"Visual Arts (painting, drawing, knitting, etc.), Learning a language, Reading, Board Games / Card Games, Cooking, Sports / Physical Activity",18,9,3,2,Tea,None,0,1,"Science & Technology, General News & Current Affairs(global or local), Computers, Art & Culture, Business, Finance & Economics, Entertainment, Sports",Windows,Piano,5,No Preference,McDonalds,Google,Pepsi,No Preference,Text your parents that you will be home later,Find a group of people and talk to them,Take the criticism and think about the issues,Google it
11/3/2022 14:49:04,J-R,21,Male,6 feet,Yes,Asian,2nd generation,1,2,1,1,1,Southern California,Senior,No,Computer Science with Business Applications,3.0 - 3.49,16,183,CS105,"AP Statistics, AP Calculus AB",No,4,Middle School or earlier,Yes,C,A,A,Software,Mobile Development,2nd generation (parents attended college),Bachelors,"Passion, Money",No,Tablet/Pen,Most of the time (51% - 99%),12,12,4,"Okay with participating in class if it is a requirement, Enjoy contributing to class discussion",4,1,2,15,1 offer in Spring 2022,Yes,On campus,No,5,Yes,No,50k - 150k,"90,000",On Campus,Walk,No,5,"Entrees, Snacks, Desserts, Juice/Tea/Coffee",Dietary restrictions,1,1,1,1,5,No,,3,10,3,0,5,2,10,3,0,"FPS, Fighting Games, Gatcha, Single Player Games, Co-op Games, Phone Games",Pokemon,Yes,20,1,5,5,5,Less than a week ago,Academics,"Food, Watching Netflix",No,Binging,Democratic,5,4,3,Not Sure,Yes,Yes,"Visual Arts (painting, drawing, knitting, etc.), Music (instrument, singing, composing, etc.), Reading, Movies, Video Games, Board Games / Card Games, Sports / Physical Activity",15,4,0,0,Tea,None,0,1," Computers, Science & Technology, Sports, Entertainment, Art & Culture",MacOS,None,0,No Preference,In-N-Out,Apple,Sprite,Spotify,Text your parents that you will be home later,Find another person in same situation,Take the criticism and think about the issues,Google it
11/3/2022 15:11:18,J-R,21,Male,5 feet 9 inches,No,Asian,Native,1,1,3,1,2,Southern California,Senior,No,Computer Science,3.0 - 3.49,12,151,CS105,AP Statistics,Yes,4,1st/2nd year of High School,No,,A,B,Cloud,Cloud,2nd generation (parents attended college),Masters,"Parents, Passion, Money",Yes,Tablet/Pen,Only when necessary,7,3,3,Enjoy contributing to class discussion,3,0,3,7,1 during Summer 2022,No,N/A,No,N/A,Yes,Yes,More than 150k,"70,000",Off-Campus (3-mile radius),Drive Yourself,No,2,Juice/Tea/Coffee,Expensive compared to other options,"Club, church",0,1,0,8,Yes,Basketball,3,5,2,0,8,3,5,0,0,,League of Legends,Yes,0,2,6,4,5,Less than a week ago,Academics,N/A,No,,None,4,3,4,Not Sure,Not Sure,Not Sure,"Music (instrument, singing, composing, etc.), Sports / Physical Activity",8,5,0,0,Tea,None,N/A,1,"1. Sports, 2. Entertainment, Art & Culture, 3. Computers, Science & Technology",MacOS,Piano,4,Nike,No Preference,Apple,No Preference,Spotify,Text your parents that you will be home later,Find a group of people and talk to them,Your self-confidence tanks,Google it
11/3/2022 15:59:05,J-R,21,Female,5’2,Yes,Black or African American,1st generation,4,2,2,2,2,Southern California,Senior,Yes,DTSE,3.5 - 4.0,16,34,CS105,AP Statistics,Yes,3,Middle School or earlier,No,,A,A,Data Science,Data Science,1st generation (first to attend),High school,"Passion, Money",No,Tablet/Pen,Only when necessary,9,6,3,Okay with participating in class if it is a requirement,3,1,5,10,,No,N/A,No,,Yes,Yes,50k - 150k,,Off-Campus (4-30 mile radius),Drive Yourself,No,6,"Snacks, Desserts, Juice/Tea/Coffee",Dietary restrictions,3,2,2,1,3,No,"Basketball, Volleyball",3,3,3,0,2,3,2,0,0,,,Yes,0,3,7,3,3,Been a while,,"Food, Reading Books, Watching Netflix",No,,Democratic,4,1,3,Not Sure,Yes,Yes,"Reading, Movies, Cooking, Sports / Physical Activity",20,10,0,0,None,None,1,3,"Current affairs, science and technology, computers",MacOS,Wind Instruments,6,No Preference,In-N-Out,Apple,Coca Cola,Spotify,Text your parents that you will be home later,Find another person in same situation,Your self-confidence tanks,Look in Textbook
11/3/2022 16:08:08,S-Z,21,Male,5'7,Yes,Asian,1st generation,1,2,3,2,1,International,Sophomore,Yes,Data Science,3.5 - 4.0,17,17,CS105,,Yes,3,Middle School or earlier,No,,A,A,Data Science,Data Science,2nd generation (parents attended college),Bachelors,Passion,No,Paper & Pen,Most of the time (51% - 99%),14,10,3,"Anxious about getting judged by your peers for an incorrect answer or “bad” question, Okay with participating in class if it is a requirement",2,1,35,10,N/A,No,N/A,No,0,No,No,50k - 150k,1k/month,Off-Campus (3-mile radius),Bicycle / Scooter / Skateboard,No,0,,Expensive compared to other options,0,,0,0,0,No,,2,30,1,0,30,4,40,30,10,"FPS, Co-op Games, Battle Royale",valorant,No,20,3,8,4,2,Been a while,Academics,Watching Netflix,Yes,Friends & Family,None,4,2,1,Not Sure,Not Sure,Yes,"Learning a language, Movies, Video Games",80,50,0,0,None,None,0,14,"Entertainment, Art & Culture/General News & Current Affairs(global or local)/Sports",Windows,None,,No Preference,McDonalds,Google,Coca Cola,No Preference,Text your parents that you will be home later,Find another person in same situation,Take the criticism and think about the issues,Google it
11/3/2022 17:43:04,S-Z,21,Male,5 feet 11 inches,No,Asian,Native,0,1,5,3,3,Southern California,Senior,No,Computer Science,3.5 - 4.0,16,200,CS105,AP Statistics,No,4,Middle School or earlier,Yes,"C++, Java, Python, HTML/CSS",A,A,Algorithms,Web Development,2nd generation (parents attended college),Masters,"Parents, Passion, Money",Yes,Paper & Pen,Only when necessary,5,5,5,Enjoy contributing to class discussion,1,1,4,2,"1 offer winter 2019, 2 offers summer 2019, 2 offers summer 2020, 1 offer summer 2021, 2 offers summer 2022, 4 offers full-time summer 2023",No,N/A,Yes,5,No,No,More than 150k,"150,000",On Campus,Walk,Yes,1,Snacks,Not hungry,0,0,0,0,0,No,Basketball,5,50,3,0,20,3,20,0,0,,Life,Yes,10,3,8,4,2,Less than a week ago,Academics,N/A,No,Friends & Family,None,3,3,3,Not Sure,Not Sure,Not Sure,"Visual Arts (painting, drawing, knitting, etc.), Performing Arts (dancing, acting, etc.), Learning a language, Movies, Board Games / Card Games, Cooking, Sports / Physical Activity",30,30,0,0,None,None,0,1,"Business Technology, Finance",MacOS,None,0,Adidas,In-N-Out,No Preference,Sprite,No Preference,Text your parents that you will be home later,Find a group of people and talk to them,Take the criticism and think about the issues,Google it
11/3/2022 17:43:34,S-Z,21,Male,5' 6'',Yes,Asian,2nd generation,1,2,1,1,2,Northern California,Senior,No,CSBA,3.5 - 4.0,13,192.5,CS105,AP Calculus AB,No,4,1st/2nd year of High School,Yes,HTML/CSS,A,A,Data Science,Data Science,2nd generation (parents attended college),Associates,"Passion, Money, Status",No,Paper & Pen,Most of the time (51% - 99%),8,8,3,"Afraid of public speaking, Okay with participating in class if it is a requirement",2,1,5,5,N/A,Yes,On campus,No,19.5,Yes,No,50k - 150k,"100,000",Off-Campus (3-mile radius),Drive Yourself,No,1,"Entrees, Snacks, Juice/Tea/Coffee",Expensive compared to other options,4,0,0,0,0,No,"Basketball, Soccer, Tennis, Badminton",3,14,2,1,3.5,2,7,2,7,"MOBA, FPS, Fighting Games, Gatcha, Single Player Games, MMORPG, Co-op Games, Rhythm Games, Battle Royale, Phone Games",TFT,Yes,8,3,7,4,4,Been a while,Love Life,"Food, Reading Books, Watching Netflix",Yes,Friends & Family,Democratic,5,3,3,Not Sure,Yes,Yes,"Reading, Video Games, Board Games / Card Games, Cooking, Sports / Physical Activity",8,5,1,1,Soda,None,1,3,"Business, sports, General News & Current Affairs(global or local)",MacOS,None,0,Nike,In-N-Out,Apple,Sprite,Apple Music,Text your parents that you will be home later,Wait until someone approaches you,Go after hours and defend each point,Ask a classmate/friend
11/3/2022 17:48:33,J-R,21,Male,"5'4""",Yes,Asian,2nd generation,1,2,1,1,2,Northern California,Senior,No,Computer Science,3.0 - 3.49,13,207.5,CS105,"AP Comp Sci A, AP Calculus AB, AP Calculus BC",No,3,Middle School or earlier,Yes,"Java, HTML/CSS",A,A,,,2nd generation (parents attended college),Bachelors,"Parents, Money",No,Paper & Pen,Only when necessary,6,6,2,"Afraid of public speaking, Anxious about getting judged by your peers for an incorrect answer or “bad” question",3,0,6,3,N/A,Yes,On campus,No,6,Yes,Yes,50k - 150k,70000,On Campus,Walk,Yes,2,Snacks,Expensive compared to other options,1,0,0,0,0,No,,2,30,1,0,5,3,12,14,0,"FPS, Gatcha",Overwatch 2,Yes,21,2,6,3,4,Been a while,,Watching Netflix,No,Binging,Democratic,3,2,3,Not Sure,Yes,Not Sure,"Reading, Movies, Video Games, Board Games / Card Games, Cooking",40,20,0,0,Tea,None,1,0,"General News & Current Affairs / Entertainment, Art & Culture / Computers, Science & Technology",MacOS,Piano,10,Nike,No Preference,Apple,No Preference,Spotify,Text your parents that you will be home later,Find another person in same situation,Your self-confidence tanks,Ask a classmate/friend
11/3/2022 18:10:33,A-I,21,Male,5 ft 6 in,No,Asian,2nd generation,1,1,2,2,2,Southern California,Senior,No,CSBA,3.0 - 3.49,12,130.5,CS111,"AP Comp Sci A, AP Calculus AB",No,1,Middle School or earlier,Yes,Java,B,A,Data Science,Web Development,2nd generation (parents attended college),Masters,Parents,Yes,Laptop/PC,Only when necessary,6,6,2,"Afraid of public speaking, Anxious about getting judged by your peers for an incorrect answer or “bad” question, Okay with participating in class if it is a requirement",2,1,5,12,N/A,Yes,On campus,No,8,Yes,No,50k - 150k,75000,On Campus,Walk,No,2,Entrees,Expensive compared to other options,,,,,,,,2,18,4,5 +,14,2,12,5,0,Phone Games,Candy Crush Saga,Yes,8,1,5,4,3,Less than a year ago,Love Life,"Food, Watching Netflix",No,Binging,None,4,2,4,Not Sure,Not Sure,Yes,"Movies, Board Games / Card Games",20,4,2,4,Soda,None,0,10,"Computers, Science and Technology",Windows,Strings,2,Vans,Jack In the Box,Apple,Sprite,Spotify,Stay at the party without notifying them you will be late,Go home,Take the criticism and think about the issues,Google it
11/3/2022 23:06:00,S-Z,27,Male,5 8,Yes,Asian,1st generation,1,2,1,1,1,Southern California,Senior,Yes,Computer Science,3.5 - 4.0,12,90,CS105,,No,4,After High School,No,,A,A,Data Science,Data Science,1st generation (first to attend),High school,"Passion, Money",No,Tablet/Pen,Only when necessary,6,6,2,"Afraid of public speaking, Anxious about getting judged by your peers for an incorrect answer or “bad” question",4,0,50,20,N/A,Yes,N/A,Yes,20,Yes,No,50k - 150k,100000,Off-Campus (3-mile radius),Walk,Yes,4,Entrees,Financial issues,One Job,None,1,1,0,No,,2,14,1,0,10,3,5,0,0,,N/A,Yes,20,5,8,3,4,Less than a month ago,Love Life,"Food, Watching Netflix",No,Binging,Democratic,5,1,5,Not Sure,Not Sure,Yes,"Movies, Video Games, Board Games / Card Games",30,10,1,1,Tea,None,0,,,Windows,None,,No Preference,In-N-Out,Apple,Pepsi,Spotify,You never told them about the party,Find another person in same situation,Take the criticism and think about the issues,Google it
11/3/2022 23:41:52,S-Z,24,Male,"6'3""",Yes,Asian,2nd generation,1,2,2,1,2,Southern California,Senior,Yes,Data Science,3.0 - 3.49,16,56,CS111,,Yes,2,1st/2nd year of High School,No,,B,B,Data Science,Data Science,1st generation (first to attend),Middle school,Money,No,Laptop/PC,Only when necessary,8,6,2,,2,0,0,7,N/A,No,N/A,No,0,Yes,No,Less than 50k,70000,On Campus,Bicycle / Scooter / Skateboard,Yes,4,"Entrees, Snacks",Expensive compared to other options,0,,0,0,0,No,"Basketball, Tennis",2,91,3,0,7,3,21,30,4,"MOBA, FPS, Gatcha, Single Player Games, MMORPG, Co-op Games, Phone Games",League of Legends,Yes,0,1,6,4,4,Less than a year ago,Love Life,N/A,Yes,Friends & Family,Democratic,5,3,3,Yes,Yes,Yes,"Reading, Movies, Video Games, Board Games / Card Games, Sports / Physical Activity",70,50,1,3,Coffee,None,1,21,"General News & Current Affairs(global or local), Science & Technology, Entertainmen",Windows,None,,Adidas,In-N-Out,Apple,Coca Cola,Spotify,Text your parents that you will be home later,Find another person in same situation,Take the criticism and think about the issues,Google it
11/4/2022 13:32:54,A-I,20,Male,6ft 0in,No,Asian,1st generation,1,2,4,1,2,Southern California,Senior,No,computer science,3.5 - 4.0,12,226,CS105,AP Calculus AB,No,4,Middle School or earlier,Yes,HTML/CSS,A,A,Machine Learning,Data Science,2nd generation (parents attended college),PhD,Passion,No,Tablet/Pen,Most of the time (51% - 99%),7,7,2,"Afraid of public speaking, Anxious about getting judged by your peers for an incorrect answer or “bad” question, Okay with participating in class if it is a requirement",5,2,1,4,"1 offer in Spring 2020, 1 offer in Summer 2020, 1 offer in Fall 2022",Yes,On campus,Yes,17,No,No,More than 150k,100000,On Campus,Walk,Yes,8,"Entrees, Snacks, Fruits/Salads, Juice/Tea/Coffee",Expensive compared to other options,3,2,0,0,0,No,,2,9,3,0,6,3,3,6,1,"FPS, Gatcha, Single Player Games, Co-op Games, Rhythm Games, Phone Games",Overwatch,Yes,2,3,7,3,3,Been a while,Love Life,Watching Netflix,No,Binging,Democratic,4,4,4,Not Sure,Yes,Yes,"Visual Arts (painting, drawing, knitting, etc.), Performing Arts (dancing, acting, etc.), Learning a language, Movies, Video Games, Board Games / Card Games",13,13,0,1,Coffee,None,0,1,"Computers, Current Affairs, Entertainment",Windows,Piano,7,No Preference,No Preference,Apple,No Preference,Spotify,Text your parents that you will be home later,Wait until someone approaches you,Go after hours and defend each point,Ask a classmate/friend
11/4/2022 13:33:13,A-I,21,Female,5’1”,Yes,Asian,2nd generation,1,1,2,1,2,Southern California,Senior,No,Computer science,3.5 - 4.0,12,217,CS105,"AP Comp Sci A, AP Statistics",Yes,3,Middle School or earlier,Yes,Java,A,A,Software,Data Science,2nd generation (parents attended college),Masters,"Parents, Money",Yes,Tablet/Pen,Most of the time (51% - 99%),6,6,1,"Afraid of public speaking, Anxious about getting judged by your peers for an incorrect answer or “bad” question",4,1,0,10,"1 offer in Winter 2022, 1 offer in Summer 2022, 1 offer in Fall 2022",Yes,On campus,Yes,15,No,No,More than 150k,75k,On Campus,Walk,Yes,2,Entrees,Expensive compared to other options,2,1,0,N/A,N/A,No,,2,25,1,0,5,2,10,0,0,"Gatcha, Co-op Games, Phone Games",Genshin,Yes,90,1,6,4,4,Less than a week ago,Thoughts about future,"Food, Watching Netflix",No,Friends & Family,None,5,2,1,Not Sure,Not Sure,Not Sure,"Music (instrument, singing, composing, etc.), Movies, Cooking",8,3,0,0,Coffee,None,0,0,"Entertainment, Art & Culture/ Computers, Science & Technology/ General News & Current Affairs(global or local)",Windows,Piano,12,No Preference,In-N-Out,Apple,Coca Cola,Amazon Prime Music,Text your parents that you will be home later,Find another person in same situation,Go after hours and defend each point,Ask a classmate/friend
11/4/2022 17:00:56,S-Z,21,Male,"5'11""",Yes,Asian,1st generation,1,2,4,2,1,International,Senior,Yes,CS,0 - 1.49,12,0,CS105,,No,4,,Yes,Python,,,Software,Web Development,2nd generation (parents attended college),PhD,"Parents, Passion, Money",No,Tablet/Pen,,7,5,3,Afraid of public speaking,1,2,12,12,,,,,,,,50k - 150k,,Off-Campus (3-mile radius),Walk,No,,Snacks,No Time,,,,,,,,1,14,2,0,,,,,,,,,,4,6,4,3,Less than a month ago,Academics,N/A,Yes,Friends & Family,,,,,,,,Movies,12,12,8oz,8oz,Coffee,None,8oz,12,"Computers, Science , Sports",MacOS,None,,puma,Jack In the Box,Apple,Pepsi,Apple Music,Text your parents that you will be home later,Find a group of people and talk to them,Go after hours and defend each point,Ask a classmate/friend
11/4/2022 17:28:58,J-R,20,Female,5'6,Yes,"Hispanic, Latino or Spanish Origin",1st generation,4,3,3,1,2,Southern California,Senior,No,CSBA,3.5 - 4.0,12,162.5,CS105,AP Statistics,No,4,Middle School or earlier,No,,A,A,,,1st generation (first to attend),High school,Money,No,Tablet/Pen,Only when necessary,7,7,3,Okay with participating in class if it is a requirement,2,0,2,8,N/A,Yes,N/A,Yes,6,Yes,No,50k - 150k,100k,Off-Campus (4-30 mile radius),Driven (Dropped-off),No,3,"Snacks, Water",Expensive compared to other options,1,0,1,0,1,No,Swim,3,15,2,2,12,3,4,0,0,"MOBA, FPS, Fighting Games, Co-op Games, Rhythm Games, Battle Royale, Phone Games",Valorant,Yes,6,4,6,4,5,Less than a year ago,Familial issues,Reading Books,Yes,Friends & Family,None,4,4,3,Not Sure,Yes,Not Sure,"Music (instrument, singing, composing, etc.), Reading, Video Games, Sports / Physical Activity",25,8,1,1,Soda,None,0,1,,MacOS,"Strings, Piano",6,Vans,In-N-Out,Apple,Coca Cola,Spotify,Text your parents that you will be home later,Find another person in same situation,Take the criticism and think about the issues,Google it
11/4/2022 17:37:01,J-R,22,Male,"5'9""",Yes,Asian,1st generation,2,3,3,2,1,Southern California,Senior,No,Computer Science,3.5 - 4.0,12,155.5,CS105,"AP Calculus AB, AP Calculus BC",Yes,3,3rd/4th year of High School,No,,A,A,Software,Backend,1st generation (first to attend),,"Passion, Money",No,Tablet/Pen,Only when necessary,8,8,4,"Anxious about getting judged by your peers for an incorrect answer or “bad” question, Enjoy contributing to class discussion",4,1,20,10,N/A,Yes,On campus,Yes,7,Yes,Yes,Less than 50k,"$130,000",Off-Campus (3-mile radius),Bicycle / Scooter / Skateboard,No,1,Entrees,Lack of options,3,3,2,2,3,No,,3,16,2,0,6,3,4,3,0,"MOBA, Single Player Games, Co-op Games, Rhythm Games, Phone Games",Forza Horizon 4/5,Yes,1,3,6-7,4,5,Less than a year ago,,N/A,No,,,5,2,2,Not Sure,Not Sure,Yes,"Movies, Video Games, Sports / Physical Activity",12,2,0,0,None,None,0,1,"Computers, Science & Technology",Windows,None,,No Preference,In-N-Out,No Preference,Coke Zero,YouTube Music,Text your parents that you will be home later,,Take the criticism and think about the issues,Ask a TA and/or professor
11/4/2022 17:47:46,S-Z,20,Male,5'7,Yes,Asian,1st generation,2,3,3,1,2,Southern California,Junior,No,Computer Science,3.5 - 4.0,13,137.5,CS105,"AP Comp Sci A, AP Calculus AB, AP Calculus BC",No,3,Middle School or earlier,Yes,Java,A,A,Software,Web Development,2nd generation (parents attended college),Masters,Money,No,Laptop/PC,Only when necessary,8,8,2,"Afraid of public speaking, Okay with participating in class if it is a requirement",2,0,2,9,N/A,Yes,N/A,Yes,5,Yes,Yes,50k - 150k,80k,Off-Campus (3-mile radius),Walk,No,4,"Entrees, Snacks",Expensive compared to other options,0,0,0,0,0,No,Tennis,2,16,0,0,0,3,10,0,0,"MOBA, FPS, Gatcha, Rhythm Games, Phone Games",League of Legends ,Yes,8,2,7,5,4,Been a while,,Food,No,Binging,None,4,2,3,Not Sure,Yes,No,"Music (instrument, singing, composing, etc.), Video Games, Sports / Physical Activity",40,6,0,0,Soda,None,0,1,"Entertainment, Art & Culture, General News & Current Affairs(global or local), Sports",Windows,"Piano, Wind Instruments",4,Adidas,In-N-Out,Apple,Fanta,Spotify,Your parents don’t set curfews,Find another person in same situation,Take the criticism and think about the issues,Google it
11/4/2022 18:08:41,A-I,20,Female,"5'5""",No,Asian,1st generation,3,2,3,3,3,Northern California,Senior,No,CSBA,3.0 - 3.49,16,182,CS105,AP Statistics,No,2,3rd/4th year of High School,No,,A,B,,,1st generation (first to attend),High school,Parents,No,Tablet/Pen,Only when necessary,10,10,3,Anxious about getting judged by your peers for an incorrect answer or “bad” question,3,,,,,No,N/A,No,,Yes,No,50k - 150k,"100,000",Off-Campus (3-mile radius),Driven (Dropped-off),No,0,,Lack of options,1,1,2,1,1,Yes,,2,5,2,0,2,3,,,,,,Yes,5,2,6,4,4,Been a while,Academics,Food,Yes,Friends & Family,None,4,4,3,Not Sure,Not Sure,Not Sure,"Cooking, Sports / Physical Activity",30,5,0,0,Energy Drinks,None,8oz,4,"Sports,  Computers, Science & Technology, Finance & Economics",Windows,None,,Nike,In-N-Out,Apple,Sprite,Spotify,Text your parents that you will be home later,Find another person in same situation,Take the criticism and think about the issues,Google it
11/4/2022 18:26:48,,,,,,,,,,,,,,,,,,,,,,,,,,,,,,,,,,,,,,,,,,,,,,,,,,,,,,,,,,,,,,,,,,,,,,,,,,,,,,,,,,,,,,,,,,,,,,,,,,,,,,,,,,,,,,,,,,,,,Use website like Chegg/Coursehero
11/4/2022 19:31:54,A-I,21,Male,6'7,Yes,Asian,2nd generation,1,2,2,1,2,Northern California,Senior,No,CS,3.5 - 4.0,16,180,Not in any of these classes,"AP Comp Sci A, AP Calculus BC",Yes,3,Middle School or earlier,Yes,Java,A,A,Algorithms,Video Game Development,2nd generation (parents attended college),Masters,"Parents, Passion, Money",No,Paper & Pen,Most of the time (51% - 99%),9,9,2,"Afraid of public speaking, Anxious about getting judged by your peers for an incorrect answer or “bad” question",4,2,5,15,N/A,Yes,On campus,Yes,5,No,No,,"$100,000",On Campus,Bicycle / Scooter / Skateboard,Yes,19,"Entrees, Juice/Tea/Coffee",Expensive compared to other options,2,1,1,1,3,Yes,"Basketball, Tennis",2,,3,0,,2,,,0,FPS,Destiny 2,Yes,3,3,7,3,5,Less than a year ago,Familial issues,,No,Binging,,,,1,Yes,Yes,Not Sure,"Video Games, Sports / Physical Activity",15,5,0.33,0,Coffee,None,1,0,"Sports, Entertainment, Business",Windows,None,,No Preference,In-N-Out,Apple,Coca Cola,Youtube,Your parents don’t set curfews,Wait until someone approaches you,Take the criticism and think about the issues,Ask a TA and/or professor
