11/4/2022 19:45:50,S-Z,23,Male,5’8’’,Yes,"Hispanic, Latino or Spanish Origin",1st generation,1,1,3,2,1,Northern California,Junior,Yes,Cs,3.0 - 3.49,12,36,CS111,"AP Comp Sci A, French, environmental science, government, english",No,4,1st/2nd year of High School,Yes,Java,C,B,Algorithms,Mobile Development,1st generation (first to attend),High school,Passion,No,Tablet/Pen,Only when necessary,6,4,3,Anxious about getting judged by your peers for an incorrect answer or “bad” question,5,1,40,40,,,,,,,,,,,,,,,,,,,,,,,,,,,,,,,,,,,,,,,,,,,,,,,,,,,,,,,,,,,,,,MacOS,,,,,,,Spotify,,Find another person in same situation,Take the criticism and think about the issues,Ask a classmate/friend
11/4/2022 20:07:17,A-I,21,Male,"5'7""",Yes,Asian,Native,1,1,2,1,2,Southern California,Junior,Yes,Computer Science,3.5 - 4.0,12,59,CS105,"AP Calculus AB, AP Calculus BC",No,4,Middle School or earlier,No,None,A,A,Software,Data Science,2nd generation (parents attended college),Bachelors,"Parents, Passion, Money, Status",Yes,Laptop/PC,Most of the time (51% - 99%),6,6,4,"Anxious about getting judged by your peers for an incorrect answer or “bad” question, Okay with participating in class if it is a requirement",5,1,10,20,N/A,No,N/A,No,0,Yes,No,50k - 150k,75000,On Campus,Walk,Yes,1,"Juice/Tea/Coffee, Water",Not convenient,0,N/A,0,N/A,0,No,N/A,1,20,3,0,7,4,0,7,0,"Single Player Games, Co-op Games, RTS, Phone Games",Clash Royale,No,1,4,6,4,1,Less than a week ago,Academics,N/A,Yes,"Listening to music, watching entertaining videos on Youtube",None,4,4,1,Not Sure,Not Sure,Not Sure,"Music (instrument, singing, composing, etc.), Video Games, Sports / Physical Activity, Rubik's cubes, juggling, hiking, gym",30,14,1,0,Tea,Increased Drowsiness,0,0,"Computers, Science & Technology/ Entertainment, Art & Culture/ Sports",Windows,"Strings, Piano",10,No Preference,In-N-Out,Samsung,Coca Cola,No Preference,Text your parents that you will be home later,Wait until someone approaches you,Take the criticism and think about the issues,Ask a TA and/or professor
11/4/2022 21:54:46,J-R,20,Female,"4'11""",Yes,Asian,1st generation,1,1,2,1,1,Southern California,Junior,No,CS,2.0 - 2.49,12,89,CS111,AP Comp Sci A,Yes,2,Middle School or earlier,Yes,"Java, HTML/CSS",A,A,,Web Development,1st generation (first to attend),High school,,No,Paper & Pen,Most of the time (51% - 99%),4,4,1,"Afraid of public speaking, Anxious about getting judged by your peers for an incorrect answer or “bad” question",3,0,9,6,N/A,No,N/A,No,0,Yes,No,Less than 50k,"$250,000",Off-Campus (3-mile radius),Bicycle / Scooter / Skateboard,No,0,Water,Expensive compared to other options,0,0,0,0,0,No,Tennis,2,12,3,0,25,3,10,2,0,Phone Games,Dreamlight Valley,No,0,2,5,5,5,Less than a week ago,Academics,Food,Yes,Friends & Family,Democratic,4,2,3,Not Sure,Not Sure,Not Sure,"Visual Arts (painting, drawing, knitting, etc.), Learning a language, Movies, Cooking, Sports / Physical Activity",20,5,0,0,Tea,None,0,1,"Art & Culture, Entertainment, General News",MacOS,Piano,2,Converse,McDonalds,Apple,Sprite,Spotify,Text your parents that you will be home later,Wait until someone approaches you,Your self-confidence tanks,Google it
11/4/2022 22:05:14,A-I,40,Female,"5'3""",No,Middle Eastern or North African,1st generation,4,2,2,2,1,Southern California,Senior,Yes,CS,3.5 - 4.0,13.5,45,CS105,,Yes,4,After High School,Yes,"Java, HTML/CSS",,,Software,Mobile Development,1st generation (first to attend),High school,"Passion, Status",No,Tablet/Pen,Only when necessary,10,10,4,Okay with participating in class if it is a requirement,5,0,,,,No,N/A,No,0,Yes,No,Less than 50k,,Off-Campus (31+ -mile radius),Drive Yourself,No,0,,Dietary restrictions,,,0,0,0,No,,2,,2,0,1,2,,0,0,,,Yes,,3,5,5,1,Less than a week ago,Academics,N/A,No,,None,5,3,1,,,,Sports / Physical Activity,7,4,2,2,Coffee,"Headaches, Increased Drowsiness",0,,,MacOS,,,Nike,,Apple,,,,,Take the criticism and think about the issues,Google it
11/4/2022 23:42:38,A-I,19,Female,"5'4""-5'5""",Yes,"Hispanic, Latino or Spanish Origin",1st generation,3,3,2,1,2,Southern California,Sophomore,No,Computer Science,3.5 - 4.0,13,60,CS111,"AP Calculus AB, AP Calculus BC",Yes,4,1st/2nd year of High School,No,None,A,A,Algorithms,Artificial Intelligence,1st generation (first to attend),High school,Passion,No,Tablet/Pen,Only when necessary,7,7,2,"Afraid of public speaking, Anxious about getting judged by your peers for an incorrect answer or “bad” question",5,4,5,12,N/A,No,N/A,No,,Yes,No,50k - 150k,"$80,000",Off-Campus (3-mile radius),Walk,No,1,"Entrees, Snacks, Fruits/Salads, Juice/Tea/Coffee",Prefer cooking/packing,4,2,2,2,2,No,,4,7,0,0,0,1,5,2,0,"MOBA, FPS, Single Player Games, MMORPG, Co-op Games",Elder Scrolls,Yes,10,4,8,4,5,Less than a week ago,Academics,Food,Yes,Friends & Family,Democratic,4,2,4,Not Sure,Not Sure,Not Sure,"Reading, Board Games / Card Games, Sports / Physical Activity",25,7,0,0,Tea,None,"Yes, 1",0,Science and Technology,MacOS,Strings,5,Nike,In-N-Out,Apple,Do not drink soda,Apple Music,Text your parents that you will be home later,Find a group of people and talk to them,Your self-confidence tanks,Ask a TA and/or professor
11/5/2022 0:35:40,A-I,23,Male,6'2'',Yes,Asian,,N/A,N/A,2,2,1,International,Senior,Yes,computer science,3.0 - 3.49,12.5,182,CS105,"AP Comp Sci A, AP Statistics, AP Calculus AB, AP Calculus BC",Yes,4,Middle School or earlier,No,,A,A,Software,Data Science,4 or more generations (great grandparents attended college),Masters,"Parents, Money",Yes,Laptop/PC,Most of the time (51% - 99%),7,7,4,Okay with participating in class if it is a requirement,2,,16,10,N/A,No,N/A,No,N/A,No,No,More than 150k,20K,Off-Campus (4-30 mile radius),Public Transportation,Yes,twice a day,"Entrees, Juice/Tea/Coffee",Lack of options,basketball,N/A,N/A,N/A,N/A,No,Basketball,3,20,4,1,50,4,50,40,10,"MOBA, Single Player Games, Phone Games","PUBG, Far Cry 6",Yes,20,3,44,4,2,Been a while,Love Life,"Food, Watching Netflix",Yes,Friends & Family,None,5,4,1,Not Sure,Not Sure,Not Sure,"Music (instrument, singing, composing, etc.), Movies, Video Games, Board Games / Card Games, Cooking, Sports / Physical Activity",30,90,5,0,Tea,None,2,1,"Business, Finance & Economics/ Entertainment, Art & Culture/ Computers",Windows,None,,Nike,McDonalds,Apple,Coca Cola,Spotify,Text your parents that you will be home later,Find another person in same situation,Take the criticism and think about the issues,Ask a classmate/friend
11/5/2022 13:43:07,S-Z,27,Male,"6'3""",Yes,White,Native,1,1,2,1,1,Southern California,Senior,Yes,CS,2.5 - 2.99,12,100,CS105,,No,1,After High School,No,,B,B,,Video Game Development,1st generation (first to attend),Masters,Money,No,Paper & Pen,Only when necessary,9,8,2,"Anxious about getting judged by your peers for an incorrect answer or “bad” question, Okay with participating in class if it is a requirement",1,0,,10,N/A,Yes,Off Campus,No,24,Yes,Yes,Less than 50k,60K,Off-Campus (3-mile radius),Bicycle / Scooter / Skateboard,No,0,Entrees,Financial issues,1,0,0,0,0,No,Soccer,2,30,3,0,8,4,6,6,2,"FPS, Single Player Games, MMORPG, Co-op Games, Battle Royale",rocket league,Yes,0,2,8,5,1,Been a while,Academics,"Food, N/A",Yes,Friends & Family,None,4,4,5,Yes,Yes,Not Sure,"Movies, Video Games, Sports / Physical Activity",10,10,1,4,Coffee,None,0,0,,Windows,None,,Vans,McDonalds,Apple,Sprite,Spotify,Your parents don’t set curfews,Find another person in same situation,Take the criticism and think about the issues,Google it
11/5/2022 15:26:51,A-I,20,Male,6'4,No,Black or African American,Native,5,1,1,1,1,Southern California,Junior,No,CSBA,3.0 - 3.49,16,140,CS105,"AP Comp Sci A, AP Calculus AB",Yes,5,1st/2nd year of High School,Yes,Java,A,B,Software,Web Development,3rd generation (grandparents attended college),Associates,"Passion, Money",No,Laptop/PC,Never,6,1,1,"Afraid of public speaking, Anxious about getting judged by your peers for an incorrect answer or “bad” question",1,1,3,16,N/A,No,N/A,No,,Yes,Yes,Less than 50k,65000,On Campus,Walk,Yes,5,Entrees,Financial issues,0,0,0,0,0,No,"Basketball, American Football",3,30,2,0,10,2,12,12,0,"FPS, Fighting Games, Single Player Games, MMORPG, Co-op Games",FF 14,Yes,0,3,6,3,1,Less than a week ago,Academics,N/A,Yes,Friends & Family,None,4,3,4,Not Sure,Yes,Yes,"Reading, Movies, Video Games, Cooking",30,14,0,0,None,None,0,1,"Entertainment, Art & Culture",Windows,None,,Nike,In-N-Out,Samsung,No Preference,Spotify,Your parents don’t set curfews,Find another person in same situation,Go after hours and defend each point,Google it
11/5/2022 15:28:19,J-R,24,Male,5’9”,No,Middle Eastern or North African,1st generation,1,1,3,2,1,International,Junior,Yes,Data Science,3.5 - 4.0,16,16,CS105,,Yes,5,After High School,Yes,C++,A,A,Data Science,Data Science,3rd generation (grandparents attended college),Masters,No other option,No,Tablet/Pen,Only when necessary,10,9,3,,3,0,18,4,0,Yes,Off Campus,No,28,Yes,Yes,Less than 50k,90000,Off-Campus (3-mile radius),Bicycle / Scooter / Skateboard,No,1,Snacks,No Time,Jobs,0,0,0,0,No,Volleyball,3,30,2,1,18,3,8,5,0,"MOBA, FPS, Fighting Games, Gatcha, Single Player Games, MMORPG, Phone Games",Rocket League Sideswipe,Yes,2,4,7,2,4,Been a while,,,,,None,4,2,1,,,,"Reading, Movies, Video Games, Cooking, Sports / Physical Activity",30,7,1,1,Tea,None,1,0,,Windows,,,No Preference,No Preference,Apple,Coca Cola,Spotify,Text your parents that you will be home later,Find a group of people and talk to them,Take the criticism and think about the issues,Google it
11/5/2022 19:37:49,A-I,18-21,Male,5'11'',Yes,Asian,1st generation,1,2,1,1,2,Southern California,Sophomore,No,CS,3.5 - 4.0,13,50,CS111,"AP Comp Sci A, AP Calculus BC",No,4,Middle School or earlier,Yes,C++,A,B,Algorithms,Web Development,1st generation (first to attend),High school,"Passion, Money",No,Paper & Pen,Only when necessary,7,4,4,"Okay with participating in class if it is a requirement, Enjoy contributing to class discussion",4,1,6,10,N/A,No,N/A,No,0,Yes,Yes,Less than 50k,"80,000",On Campus,Walk,Yes,3,"Entrees, Snacks",Expensive compared to other options,3,3,5,4,3,Yes,"Basketball, Soccer",3,15,2,0,15,3,15,5,1,"FPS, Fighting Games",Halo Infinite,Yes,5,3,8,3,3,Been a while,Self agony,N/A,Yes,Friends & Family,None,3,3,3,Not Sure,Not Sure,Not Sure,"Music (instrument, singing, composing, etc.), Video Games, Board Games / Card Games",8,2,0,0,Soda,,0,1,"Computers, Science and Technology, Entertainment",Windows,Strings,1,Reeboks,Subway,Google,Mountain Drew,Spotify,Text your parents that you will be home later,Find a group of people and talk to them,Your self-confidence tanks,Ask a classmate/friend
11/5/2022 23:41:49,A-I,20,Female,5'2,Yes,Asian,1st generation,1,2,2,2,2,Southern California,Sophomore,No,currently undeclared but filled out change of major request form beginning of this quarter,3.5 - 4.0,17,77,CS010C,AP Calculus AB,Yes,3,Middle School or earlier,No,,A,A,Data Science,Data Science,2nd generation (parents attended college),PhD,"Passion, Money",No,Tablet/Pen,Every time (100%),7,7,1,"Afraid of public speaking, Anxious about getting judged by your peers for an incorrect answer or “bad” question",5,2,18,8,N/A,No,N/A,No,,Yes,Yes,50k - 150k,$60k,Off-Campus (3-mile radius),Walk,No,1,"Entrees, Snacks, Juice/Tea/Coffee",Expensive compared to other options,1,0,0,,,No,,1,0,4,0,4,3,11,0,,,,Yes,0,3,6,4,4,Less than a year ago,Self agony,N/A,No,,None,4,3,3,Not Sure,Yes,Not Sure,"Visual Arts (painting, drawing, knitting, etc.), Performing Arts (dancing, acting, etc.), Music (instrument, singing, composing, etc.), Reading, Cooking, Sports / Physical Activity",21,3,4oz a week (most of the time 0 I try not to drink if I don't have to because it triggers panic attack),0,Tea,"Headaches, Increased Anxiety, Increased Drowsiness",4oz,2," Art & Culture/ Computers, sports, General News & Current Affairs(global or local)",Linux,"Strings, Piano, Wind Instruments","guitar(3yrs), piano (10 but on and off), trumpet (1), viola(1)",No Preference,No Preference,Apple,Coca Cola,Spotify,Text your parents that you will be home later,Go home,Take the criticism and think about the issues,Look in Textbook
11/6/2022 1:10:35,J-R,22,Male,"5'9""",Yes,Black or African American,3rd generation or more,1,1,6,2,1,Southern California,Senior,Yes,Computer Science,2.5 - 2.99,16,180,CS105,,Yes,3,3rd/4th year of High School,Yes,"C++, HTML/CSS",B,A,Algorithms,Video Game Development,4 or more generations (great grandparents attended college),Bachelors,Passion,Yes,Paper & Pen,Only when necessary,9,6,3,Anxious about getting judged by your peers for an incorrect answer or “bad” question,5,0,0,20,N/A,Yes,Off Campus,No,5,Yes,No,More than 150k,80k,Off-Campus (4-30 mile radius),Drive Yourself,No,2,Snacks,Expensive compared to other options,2,1,2,1,5,No,,3,30,0,0,0,,0,15,0,"FPS, Fighting Games, Single Player Games, Rhythm Games",Beatmania IIDX,Yes,5,5,8,3,5,Been a while,Familial issues,N/A,Yes,Friends & Family,Independent,4,3,5,Yes,Yes,Yes,"Music (instrument, singing, composing, etc.), Learning a language, Video Games",30,15,0,0,None,None,0,0,,TempleOS,"Strings, Percussion, Piano, Wind Instruments",13,No Preference,In-N-Out,Sony,No Preference,,Your parents don’t set curfews,Find a group of people and talk to them,Take the criticism and think about the issues,Ask a classmate/friend
11/6/2022 10:47:41,A-I,20,Male,6’2”,No,White,Native,4,5,1,1,1,Southern California,Junior,No,Computer Science,3.0 - 3.49,12,90,CS111,AP Calculus AB,No,3,3rd/4th year of High School,No,,A,A,Software,Data Science,3rd generation (grandparents attended college),Masters,"Passion, Money, Status",No,Paper & Pen,Most of the time (51% - 99%),7,3,1,"Afraid of public speaking, Okay with participating in class if it is a requirement",4,0,0,10,N/A,Yes,Off Campus,No,25,Yes,Yes,50k - 150k,"$60,000",Off-Campus (3-mile radius),Drive Yourself,No,2,"Entrees, Soda, Juice/Tea/Coffee, Water",Not convenient,0,N/A,0,N/A,N/A,No,,1,~80,0,0,3,5,~40,~25,~15,"MOBA, FPS, Fighting Games, Single Player Games, Co-op Games, Rhythm Games, RTS",Overwatch or League of Legends,No,2,3,5,3,5,Less than a week ago,Self agony,"Food, Watching Netflix",No,Binging,Democratic,2,3,4,Not Sure,Not Sure,Not Sure,"Music (instrument, singing, composing, etc.), Movies, Video Games, Board Games / Card Games, Cooking",90,40,Literally too much to count,Literally too much to count,Soda,"Headaches, Increased Anxiety, Increased Drowsiness",Non-stop caffeine,1,N/A (whatever shows up),Windows,Wind Instruments,8,No Preference,No Preference,Apple,Diet Coke,Spotify,Your parents don’t set curfews,Wait until someone approaches you,Your self-confidence tanks,Ask a TA and/or professor
11/6/2022 11:28:32,A-I,19,Male,"5'6""",No,"Hispanic, Latino or Spanish Origin",1st generation,2,2,2,2,2,Southern California,Sophomore,No,Computer Science,3.0 - 3.49,16,63,CS010C,N/A,Yes,4,3rd/4th year of High School,No,N/A,A,B,Software,Video Game Development,1st generation (first to attend),Middle School,"Money, Wanted to try out and see if I liked",No,Paper & Pen,Only when necessary,8,8,3,Okay with participating in class if it is a requirement,3,0,1,30,N/A,No,N/A,No,0,Yes,No,Less than 50k,N/A,Off-Campus (4-30 mile radius),Drive Yourself,No,0,N/A,Prefer cooking/packing,0,N/A,N/A,N/A,N/A,No,N/A,2,40,2,0,10,3,20,20,2,"FPS, Fighting Games, Single Player Games",Super Smash Bros,No,0.5,4,7-8 daily,2,2,Been a while,Academics,N/A,No,Doing nothing but think,Democratic,3,4,4,Not Sure,Not Sure,Yes,"Visual Arts (painting, drawing, knitting, etc.), Learning a language, Reading, Movies, Video Games",,45,0,0,None,None,0,1.5,"Entertainment, Current Affairs, Science",N/A,None,N/A,No Preference,No Preference,No Preference,Sprite,No Preference,Text your parents that you will be home later,Find a group of people and talk to them,Take the criticism and think about the issues,Google it
11/6/2022 13:28:06,J-R,19,Female,"5'7""",Yes,Asian,2nd generation,3,3,2,2,2,Southern California,Sophomore,No,Computer Science,3.0 - 3.49,13,,CS010C,"AP Comp Sci A, AP Calculus AB, AP Calculus BC",No,2,1st/2nd year of High School,Yes,"C++, JavaScript",B,B,Software,Video Game Development,1st generation (first to attend),Middle School,"Passion, Money",No,Tablet/Pen,Every time (100%),6,all,1,"Afraid of public speaking, Anxious about getting judged by your peers for an incorrect answer or “bad” question",2,1,3,6,N/A,Yes,Off Campus,No,10,Yes,No,Less than 50k,,Off-Campus (3-mile radius),Walk,No,4,"Entrees, Juice/Tea/Coffee",Financial issues,,,,,,,,1,5,2,1,3,1,5,2,0,,Minecraft,Yes,4,1,5,5,5,Less than a week ago,Academics,Reading Books,,Friends & Family,Democratic,4,2,3,Yes,Yes,Not Sure,"Reading, Movies, Board Games / Card Games, Cooking",5,4,0,0,None,"Headaches, Increased Anxiety",,,,MacOS,Strings,3,Vans,Jack In the Box,Apple,No Preference,Spotify,Text your parents that you will be home later,Go home,Take the criticism and think about the issues,Ask a classmate/friend
11/6/2022 15:15:01,A-I,24,Male,5'11''-6',No,Asian,1st generation,1,2,2,2,1,International,Master's,No,Computer Science,3.5 - 4.0,12,12,CS105,"AP Statistics, AP Calculus AB, AP Calculus BC",No,4,Middle School or earlier,No,,,,Data Science,Data Science,3rd generation (grandparents attended college),Masters,"Passion, Money",No,Paper & Pen,Only when necessary,6,6,4,Okay with participating in class if it is a requirement,2,1,28,10,N/A,No,N/A,No,0,No,Yes,Less than 50k,"$100,000",Off-Campus (3-mile radius),Bicycle / Scooter / Skateboard,No,1,Snacks,Financial issues,1,0,0,0,0,No,Volleyball,2,30,4,1,20,3,10,0,0,Phone Games,PUBG,No,3,4,7,2,1,Been a while,,N/A,No,,Independent,4,4,2,Yes,Yes,Yes,Sports / Physical Activity,28,14,0,0,None,None,0,7,"Sports, General News & Current Affairs, Computers, Science & Technology",Windows,None,,Nike,No Preference,Apple,No Preference,Spotify,Text your parents that you will be home later,Find another person in same situation,Take the criticism and think about the issues,Look in Textbook
11/6/2022 15:39:10,A-I,20,Male,5'11,No,"Hispanic, Latino or Spanish Origin",2nd generation,2,1,1,1,1,Southern California,Junior,Yes,Data Science,2.5 - 2.99,16,16,CS105,"AP Statistics, AP Calculus AB",No,4,Middle School or earlier,Yes,"C++, Java",B,B,Data Science,Data Science,2nd generation (parents attended college),Bachelors,"Parents, Passion, Money",No,Tablet/Pen,Most of the time (51% - 99%),8,4,4,"Okay with participating in class if it is a requirement, Enjoy contributing to class discussion",3,0,6,6,N/A,No,N/A,No,0,No,Yes,50k - 150k,"80,000",Off-Campus (4-30 mile radius),Drive Yourself,No,5,"Entrees, Snacks, Juice/Tea/Coffee",Expensive compared to other options,0,0,0,0,0,No,Water Polo,3,2,1,1,2,4,2,8,4,"FPS, Co-op Games",League of Legends,No,2,2,7,4,2,Been a while,Love Life,"Food, Alcohol/Drugs",Yes,Friends & Family,Democratic,4,3,5,Not Sure,Yes,Not Sure,"Movies, Video Games, Sports / Physical Activity",20,8,1,2,Coffee,None,0,3,"Business, Science & Technology, General News & Current Affairs",Windows,Brass (Trumpet),1,Vans,In-N-Out,Apple,Dr. Pepper,Apple Music,Your parents don’t set curfews,Wait until someone approaches you,Take the criticism and think about the issues,Google it
11/6/2022 16:41:35,J-R,23,Male,"5'11""",Yes,Asian,1st generation,1,1,3,2,2,International,Senior,Yes,Computer Science,3.0 - 3.49,12,98,CS105,N/A,Yes,2,Middle School or earlier,No,N/A,A,B,Software,Mobile Development,3rd generation (grandparents attended college),Masters,Parents,No,Paper & Pen,Most of the time (51% - 99%),6,4,3,Okay with participating in class if it is a requirement,2,0,6,10,N/A,No,N/A,No,0,No,No,Less than 50k,0,Off-Campus (3-mile radius),Drive Yourself,No,5,"Entrees, Fruits/Salads, Soda, Water",Dietary restrictions,1,0,1,1,1,No,N/A,3,20,2,0,20,2,20,0,0,,N/A,No,2,2,6,4,1,Less than a week ago,Academics,"Watching Netflix, Alcohol/Drugs",No,Masturbation,None,3,3,1,Not Sure,Not Sure,Not Sure,"Music (instrument, singing, composing, etc.), Movies",30,14,0,0,Soda,None,0,0,N/A,Windows,Piano,10,Converse,Panda Express,Apple,Coca Cola,No Preference,Text your parents that you will be home later,Find a group of people and talk to them,Your self-confidence tanks,Ask a classmate/friend
11/6/2022 16:43:32,S-Z,21,Male,"5'10""",Yes,"Hispanic, Latino or Spanish Origin",1st generation,3,4,3,2,1,Central California,Senior,Yes,Psych & CompSci,3.5 - 4.0,17,180,CS010C,AP Comp Sci A,No,5,Middle School or earlier,No,,A,A,Software,Web Development,1st generation (first to attend),High school,Passion,No,Tablet/Pen,Only when necessary,8,6,5,"Okay with participating in class if it is a requirement, Enjoy contributing to class discussion",4,1,2,10,N/A :(,Yes,On campus,No,16,Yes,Yes,Less than 50k,75000,On Campus,Walk,No,4,"Entrees, Fruits/Salads",Lack of options,3,0,1,0,2,No,Soccer,3,7,3,1,4,3,3,1,0,"FPS, Co-op Games",COD,Yes,8,3,6,5,1,Been a while,Love Life,N/A,No,Time,Democratic,4,4,5,Not Sure,Yes,Yes,"Movies, Video Games, Board Games / Card Games, Cooking, Sports / Physical Activity",20,2,0,0,None,None,"Yes, 8oz if I have work early",1,"Science & Technology, Sports, Finance & Economics",Windows,None,,Puma,McDonalds,Samsung,Sprite,Spotify,Text your parents that you will be home later,Find another person in same situation,Take the criticism and think about the issues,Google it
11/6/2022 17:10:50,J-R,24,Male,"5'8"" - 5'10""",Yes,Asian,1st generation,0,1,4,3,3,International,Master's,No,Computer Science,3.5 - 4.0,12,36,CS105,"AP Comp Sci A, AP Statistics, AP Calculus AB",No,2,Middle School or earlier,Yes,"C++, Java, HTML/CSS",A,A,Data Science,Data Science,2nd generation (parents attended college),Bachelors,"Passion, Money, Status",No,Laptop/PC,Only when necessary,6,4,3,"Okay with participating in class if it is a requirement, Enjoy contributing to class discussion",4,2,12,8,1 Offer in Summer 2021,Yes,On campus,Yes,20,No,Yes,Less than 50k,120000,Off-Campus (3-mile radius),Bicycle / Scooter / Skateboard,No,2,Entrees,Financial issues,0,0,0,0,0,No,,4,5,1,0,7,3,12,4,0,"FPS, Phone Games",Rocket League,Yes,0,4,6,4,4,Less than a week ago,Academics,Food,Yes,Friends & Family,Democratic,5,5,4,Yes,Yes,Yes,"Learning a language, Reading, Movies, Video Games, Cooking, Sports / Physical Activity",30,10,3,0,Coffee,Increased Drowsiness,3,7,"Computers, Science & Technology, Business, Finance & Economics, General News & Current Affairs(global or local)",Windows,None,N/A,Nike,Subway,Google,Coca Cola,Spotify,Text your parents that you will be home later,Find a group of people and talk to them,Go after hours and defend each point,Ask a TA and/or professor
11/6/2022 18:06:28,A-I,25,Female,5'2,Yes,"Hispanic, Latino or Spanish Origin",1st generation,2,3,2,1,2,Southern California,Senior,Yes,cs major,2.5 - 2.99,8,58.5,CS105,n/a,Yes,3,3rd/4th year of High School,No,n/a,B,A,Software,Video Game Development,1st generation (first to attend),middle school,Friends,No,Laptop/PC,Every time (100%),4,4,2,Anxious about getting judged by your peers for an incorrect answer or “bad” question,3,1,5,3,n/a,No,N/A,No,0,Yes,Yes,Less than 50k,60000,Off-Campus (3-mile radius),Driven (Dropped-off),No,0,n/a,Expensive compared to other options,0,n/a,0,0,0,No,n/a,2,25,4,0,10,4,14,10,10,"FPS, Single Player Games, MMORPG, Co-op Games, Phone Games",Final Fantasy XIV,No,0,2,6,4,5,Less than a month ago,Self agony,N/A,Yes,Friends & Family,Democratic,3,2,3,Not Sure,Not Sure,Yes,"Movies, Video Games",35,15,0,0,Coffee,Increased Drowsiness,1,2,"Entertainment, Art & Culture, Computers, Science & Technology, and Current Affairs(global or local)",Windows,Piano,0,No Preference,No Preference,Samsung,Sprite,Spotify,Start heading home immediately,Wait until someone approaches you,Your self-confidence tanks,Ask a classmate/friend
11/7/2022 0:12:19,A-I,23,Non-binary/non-conforming,"5'5""",Yes,Asian,1st generation,4,1,3,1,2,Southern California,Senior,No,Computer Science,2.5 - 2.99,12,210,CS105,,Yes,4,1st/2nd year of High School,Yes,Java,A,B,Hardware,Hardware,3rd generation (grandparents attended college),Bachelors,"Passion, Money",No,Laptop/PC,Only when necessary,7,7,4,"Okay with participating in class if it is a requirement, Enjoy contributing to class discussion",4,1,4,6,N/A,No,N/A,No,0,Yes,Yes,More than 150k,"$70,000",Off-Campus (3-mile radius),Public Transportation,No,5,"Entrees, Juice/Tea/Coffee",Prefer cooking/packing,1,1,1,0,2,No,Marching Band,5,40,0,0,0,3,20,20,0,"FPS, Fighting Games, Single Player Games, MMORPG, Co-op Games, Rhythm Games",Rimworld,Yes,3,4,7,2,4,Less than a week ago,Academics,"Food, Reading Books, Watching Netflix",Yes,Friends & Family,Democratic,5,2,5,Yes,Yes,Yes,"Reading, Movies, Video Games, Board Games / Card Games, Cooking",30,4,1,1,Tea,None,1,7,"General News & Current Affairs/ Entertainment, Art & Culture / Computers, Science & Technology",Windows,"Strings, Wind Instruments",8,No Preference,In-N-Out,No Preference,Root beer,Youtube,Text your parents that you will be home later,Find a group of people and talk to them,Go after hours and defend each point,Ask a classmate/friend
