11/8/2022 11:28:41,J-R,19,Male,6'1,No,White,3rd generation or more,2,3,1,1,1,Southern California,Sophomore,No,CSBA,3.5 - 4.0,17,55,CS111,"AP Comp Sci A, AP Statistics, AP Calculus AB",Yes,4,Middle School or earlier,Yes,"Java, Python, HTML/CSS",A,A,Software,Machine Learning,3rd generation (grandparents attended college),Masters,Passion,No,Paper & Pen,Only when necessary,4,3,3,"Okay with participating in class if it is a requirement, Enjoy contributing to class discussion",4,0,0,5,N/A,No,N/A,No,0,No,No,More than 150k,100000,Off-Campus (3-mile radius),Bicycle / Scooter / Skateboard,No,1,Entrees,Expensive compared to other options,1,0,0,0,0,No,"Cross Country, Track and Field",3,35,2,1,15,2,20,0,0,"MOBA, FPS, Co-op Games, Battle Royale, Phone Games",Minecraft,Yes,5,5,8.5,5,5,Less than a week ago,Feeling unaccomplished ,Watching Netflix,No,Friends & Family,Democratic,5,3,5,Yes,Yes,Yes,"Movies, Video Games, Board Games / Card Games, Sports / Physical Activity",60,20,0,0,Coffee,None,1,1,"Sports/ Computers, Science and Technology/ Business, Finance and Economics",Windows,None,,Nike,In-N-Out,Apple,Coca Cola,Spotify,Your parents don’t set curfews,Wait until someone approaches you,Take the criticism and think about the issues,Ask a classmate/friend
11/8/2022 11:29:22,J-R,19,Male,"5'7""",Yes,Asian,2nd generation,1,2,2,1,1,Southern California,Sophomore,No,Computer Science,3.5 - 4.0,17,102,CS111,"AP Comp Sci A, AP Calculus AB, AP Calculus BC",Yes,3,1st/2nd year of High School,Yes,"Java, Python, HTML/CSS",A,A,Software,Video Game Development,1st generation (first to attend),High school,"Passion, Money",No,Paper & Pen,Never,10,10,3,Anxious about getting judged by your peers for an incorrect answer or “bad” question,2,0,2,9,N/A,No,N/A,No,0,Yes,No,Less than 50k,60k,Off-Campus (4-30 mile radius),Carpool,No,5,Entrees,Not hungry,0,0,0,0,0,No,Tennis,2,11,1,0,1,3,5,3,0,"MOBA, FPS, Co-op Games, Rhythm Games",Overwatch 2,Yes,"eating, lounging",4,7,4,2,Less than a week ago,Academics,N/A,No,Time,None,3,3,3,Not Sure,Not Sure,Not Sure,"Learning a language, Video Games, Cooking, Sports / Physical Activity",5,60,0,0,None,None,0,7,"Entertainment, Computers, Science & Technology",Windows,None,0,Nike,No Preference,Apple,No Preference,No Preference,Your parents don’t set curfews,Wait until someone approaches you,Take the criticism and think about the issues,Google it
11/8/2022 11:33:30,J-R,20,Female,"5'6""",Yes,Asian,1st generation,1,1,3,1,2,Southern California,Junior,No,Computational Math,3.0 - 3.49,13,140,CS111,AP Calculus AB,Yes,4,Middle School or earlier,No,,A,B,Data Science,Data Science,1st generation (first to attend),Masters,"Parents, Passion, Money",No,Tablet/Pen,Most of the time (51% - 99%),2,1,3,"Anxious about getting judged by your peers for an incorrect answer or “bad” question, Okay with participating in class if it is a requirement",4,1,2,4,2 offers in Summer 2022,No,N/A,No,N/a,No,No,More than 150k,90k,Off-Campus (4-30 mile radius),Drive Yourself,No,1,"Snacks, Juice/Tea/Coffee",Prefer cooking/packing,2,0,1,1,2,No,Volleyball,4,30,3,1,10,3,3,0,0,,,Yes,10,4,7,4,3,Less than a week ago,Academics,N/A,Yes,Friends & Family,Democratic,5,4,3,Yes,No,Yes,"Performing Arts (dancing, acting, etc.), Music (instrument, singing, composing, etc.), Learning a language, Reading, Movies, Board Games / Card Games, Cooking, Sports / Physical Activity",20,15,1,1,Coffee,Increased Drowsiness,2,0.5,"Business,  Computers, Science & Technology, General News & Current Affairs(global or local)",MacOS,Piano,4,Nike,In-N-Out,Apple,Sprite,Spotify,Text your parents that you will be home later,Find another person in same situation,Take the criticism and think about the issues,Google it
11/8/2022 11:42:00,J-R,19,Male,"5'10""",No,White,Native,4,1,3,1,1,Southern California,Sophomore,No,Computer Science,3.5 - 4.0,17,57,CS105,"AP Calculus BC, AP Comp Sci Principles",Yes,4,Middle School or earlier,Yes,"C++, Python, HTML/CSS, C#",A,A,Algorithms,Data Science,1st generation (first to attend),High school,Passion,No,Paper & Pen,Only when necessary,10,9,3,Okay with participating in class if it is a requirement,2,0,2,12,N/A,No,N/A,No,30,Yes,No,50k - 150k,60000,Off-Campus (3-mile radius),Bicycle / Scooter / Skateboard,No,1,"Entrees, Soda",Financial issues,1,0,1,0,10,No,,2,6,1,0,3,3,8,6,0,"FPS, Single Player Games, Co-op Games",Minecraft,No,20,2,8,4,4,Less than a year ago,Familial issues,"Food, Watching Netflix",Yes,Friends & Family,Independent,3,2,2,Not Sure,No,No,"Visual Arts (painting, drawing, knitting, etc.), Learning a language, Reading, Movies, Video Games, Board Games / Card Games, Cooking",20,6,3,2,Coffee,Headaches,0,0,"Finance & Economics, Computers, Business",Windows,None,0,No Preference,McDonalds,Apple,Pepsi,No Preference,Start heading home immediately,Find another person in same situation,Take the criticism and think about the issues,Google it
11/8/2022 12:13:36,J-R,23,Male,6’4’’,No,White,Native,1,1,1,1,1,Southern California,Senior,Yes,Computer Science ,2.5 - 2.99,12,175,CS105,,No,4,1st/2nd year of High School,No,,B,B,Software,Video Game Development,2nd generation (parents attended college),Bachelors,Passion,No,Paper & Pen,Only when necessary,2,2,3,Okay with participating in class if it is a requirement,3,0,6,12,N/A,Yes,Off Campus,No,20,Yes,No,Less than 50k,50000,Off-Campus (31+ -mile radius),Drive Yourself,No,1,Entrees,Not hungry,0,0,0,0,0,No,None ,1,20,4,5 +,25,3,18,35,2,"MOBA, FPS, Fighting Games, Single Player Games, Rhythm Games, Battle Royale",League of legends ,No,2,4,8 hours ,4,5,Less than a month ago,Self agony,N/A,Yes,Friends & Family,Independent,3,2,3,Not Sure,Not Sure,Not Sure,"Visual Arts (painting, drawing, knitting, etc.), Music (instrument, singing, composing, etc.), Movies, Video Games, Board Games / Card Games, Cooking, Sports / Physical Activity",40,25,0,0,Energy Drinks,None,0,2,"Entertainment, Business, sports ",Windows,Wind Instruments,1,No Preference,In-N-Out,Apple,Diet drinks,Spotify,Text your parents that you will be home later,Wait until someone approaches you,Take the criticism and think about the issues,Ask a TA and/or professor
11/8/2022 12:42:54,A-I,19,Male,"5'8""",Yes,Asian,2nd generation,5,2,1,1,1,Southern California,Sophomore,No,Computer Science,3.5 - 4.0,18,93,CS111,"AP Comp Sci A, AP Calculus AB, AP Calculus BC, AP Comp Sci Principles",No,4,1st/2nd year of High School,Yes,"Java, Python",A,A,Algorithms,Video Game Development,2nd generation (parents attended college),Bachelors,"Passion, Money",No,Paper & Pen,Most of the time (51% - 99%),8,8,3,"Afraid of public speaking, Anxious about getting judged by your peers for an incorrect answer or “bad” question",2,0,18,22,N/A,No,N/A,No,N/A,Yes,No,Less than 50k,$100k,Off-Campus (4-30 mile radius),Drive Yourself,No,1,Entrees,Prefer cooking/packing,0,N/A,0,0,0,No,Basketball,1,10,2,0,24,3,30,9,9,"Gatcha, Single Player Games, MMORPG, Rhythm Games",Persona 4,No,2,4,7,3,2,Less than a month ago,Academics,"Food, Reading Books",Yes,Friends & Family,None,3,3,2,Not Sure,Not Sure,Not Sure,"Reading, Video Games, Sports / Physical Activity",24,13,1,7,Coffee,None,0,8,"Sports/ Entertainment, Art & Culture/ Computers, Science & Technology",Windows,None,0,Nike,No Preference,Apple,Pepsi,Spotify,Text your parents that you will be home later,Wait until someone approaches you,Take the criticism and think about the issues,Google it
11/8/2022 12:50:14,J-R,19,Male,,Yes,Asian,1st generation,,,,,,Northern California,Junior,No,MSE,3.0 - 3.49,,,CS9A,,,,,,,,,,,,,,,,,,,,,,,,,,,,,,,,,,,,,,,,,,,,,,,,,,,,,,,,,,,,,,,,,,,,,,,,,,,,,,,,,,,,,,,,,,,,,,,,,
11/8/2022 12:57:50,A-I,19,Male,5'9'',No,Asian,,2,1,4,2,1,International,Freshman,No,Economics,3.5 - 4.0,17,0,CS009A,"IB Math AI HL, IB CS SL",Yes,4,Middle School or earlier,Yes,"Java, Python, HTML/CSS",,,Data Science,Data Science,1st generation (first to attend),High school,"Parents, Passion, Status",No,Tablet/Pen,Most of the time (51% - 99%),9,8,5,Enjoy contributing to class discussion,4,1,7,10,N/A,No,N/A,No,,No,No,More than 150k,,On Campus,Walk,Yes,14,"Entrees, Snacks, Soda, Juice/Tea/Coffee",Lack of options,1,0,0,0,0,No,Fencing,2,10,4,3,10,3,9,1,0,Phone Games,,Yes,18,4,5,3,1,Less than a year ago,Academics,N/A,Yes,Friends & Family,Republican,4,1,1,Not Sure,Not Sure,No,"Performing Arts (dancing, acting, etc.), Movies, Sports / Physical Activity",10,6,2,2,Coffee,Increased Drowsiness,1,4,"Computers, science, technology / sports / business, finance & economics",MacOS,Piano,3,Nike,In-N-Out,Apple,Sprite,Apple Music,Text your parents that you will be home later,Wait until someone approaches you,Go after hours and defend each point,Google it
11/8/2022 13:03:33,A-I,21,Male,"5'7""",No,"Hispanic, Latino or Spanish Origin",2nd generation,3,3,2,2,2,Southern California,Senior,No,Computer Science,3.0 - 3.49,16,165,CS105,n/a,No,4,Middle School or earlier,Yes,none,A,A,Software,Artificial intelligence ,1st generation (first to attend),High school,"Passion, Money",No,Paper & Pen,Most of the time (51% - 99%),10,10,4,Okay with participating in class if it is a requirement,4,0,10,8,N/A,No,N/A,No,0,Yes,No,Less than 50k,"$80,000",On Campus,Walk,No,2,"Entrees, Snacks",Expensive compared to other options,2,0,1,0,0,No,N/A,3,24,1,0,2,3,25,4,0,"FPS, Fighting Games, Single Player Games, Co-op Games, Rhythm Games, Battle Royale, RTS, Phone Games",Terraria,Yes,10,3,7,2,1,Less than a week ago,Academics,N/A,No,Friends & Family,Democratic,1,1,5,No,Yes,No,"Performing Arts (dancing, acting, etc.), Movies, Video Games, Board Games / Card Games",50,25,0,0,Tea,"Headaches, Increased Anxiety",0,0,"Culture/ Computers, Science & Technology",MacOS,Strings,1,Nike,In-N-Out,Apple,Coca Cola,Apple Music,Text your parents that you will be home later,Find another person in same situation,Take the criticism and think about the issues,Ask a classmate/friend
11/8/2022 13:29:32,J-R,19,Male,5'6'',Yes,Asian,1st generation,1,2,3,2,1,International,Sophomore,No,CS,3.5 - 4.0,15,90,CS111,,,,,,,,,,,,,,,,,,,,,,,,,,,,,,,,,,Off-Campus (3-mile radius),,,,,,,,,,,,,3,,,,,,,,,,,,,,,3,,,,,,,,,,,,,,,,,,,,,,,,,,,,,,,,,,,
11/8/2022 13:35:44,S-Z,19,Male,5'6,Yes,Asian,2nd generation,2,1,1,1,1,Southern California,Sophomore,No,Computer Science BS,3.0 - 3.49,16,81,CS010C,"AP Calculus AB, AP Calculus BC",Yes,3,Middle School or earlier,No,,A,A,Algorithms,Video Game Development,2nd generation (parents attended college),PhD,Passion,No,Paper & Pen,Only when necessary,7,6,3,"Afraid of public speaking, Anxious about getting judged by your peers for an incorrect answer or “bad” question",1,0,1,30,n/a,No,N/A,No,n/a,No,No,More than 150k,"60,000",Off-Campus (3-mile radius),Walk,No,6,"Entrees, Snacks, Fruits/Salads, Water",Expensive compared to other options,2,1,2,1,4,No,Tennis,2,12,1,0,2,3,6,4,0,"MOBA, FPS, Gatcha, Phone Games",Epic Seven,No,8,2,6,4,4,Less than a month ago,Love Life,Watching Netflix,Yes,Friends & Family,None,5,2,2,Not Sure,Not Sure,Not Sure,"Movies, Video Games, Board Games / Card Games, Cooking, Sports / Physical Activity",50,16,0,0,None,None,0,0,"computers, science and technology
sports
entertainment, art and culture",Windows,Strings,10,Vans,In-N-Out,Apple,No Preference,Spotify,Text your parents that you will be home later,Wait until someone approaches you,Take the criticism and think about the issues,Google it
11/8/2022 14:26:15,J-R,19,Female,"5'0""",Yes,Asian,2nd generation,None,1,2 (this is a summation of different languages based on fluency),1,2,Northern California,Sophomore,No,CSBA,3.5 - 4.0,17,71,CS111,"AP Comp Sci A, AP Statistics, AP Calculus AB",No,4,Middle School or earlier,Yes,"Java, HTML/CSS",A,A,Software,Video Game Development,2nd generation (parents attended college),Masters,"Parents, Passion, Money",Yes,Laptop/PC,Most of the time (51% - 99%),8,8,4,Enjoy contributing to class discussion,5,0,21,35,N/A,No,N/A,No,None,No,No,More than 150k,3000,On Campus,Walk,Yes,2,Juice/Tea/Coffee,Expensive compared to other options,None,None,None,None,None,No,None,3,35,1,2,7,3,35,7,10,"Gatcha, Phone Games",Not really currently playing one right now,Yes,1,4,7,4,3,Been a while,Academics,Reading Books,Yes,Friends & Family,None,3,2,4,Not Sure,Not Sure,Not Sure,"Visual Arts (painting, drawing, knitting, etc.), Reading, Video Games",21,21,8oz,8 oz,Coffee,None,0,,"Business, Finance & Economics/ Entertainment, Art & Culture/ Computers, Science & Technology",Windows,None,None,No Preference,No Preference,No Preference,No Preference,No Preference,Text your parents that you will be home later,Find a group of people and talk to them,Take the criticism and think about the issues,Look in Textbook
11/8/2022 15:34:48,J-R,20,Male,"5'9""",Yes,Asian,2nd generation,1,2,2,2,2,Southern California,Junior,No,CS,3.5 - 4.0,17.5,143.5,best friend,"AP Comp Sci A, AP Calculus BC",Yes,2,Middle School or earlier,Yes,C++,A,A,Software,Software,2nd generation (parents attended college),Bachelors,"Parents, Passion, Money, Status",No,Tablet/Pen,Most of the time (51% - 99%),7,3,4,"Okay with participating in class if it is a requirement, Enjoy contributing to class discussion, besties",1,0,5,5,"1 offer in Summer 2020, 2 offers in Summer 2021, 3 offers in Summer 2022",Yes,On campus,Yes,10,Yes,Yes,Less than 50k,200000,On Campus,Bicycle / Scooter / Skateboard,No,3,"Entrees, Snacks, Juice/Tea/Coffee",Not convenient,6,6,1,1,2,Yes,"Basketball, Baseball, Soccer",3,20,3,0,5,4,15,0,0,,,Yes,4,3,9,2,2,Less than a week ago,Love Life,"Food, Watching Netflix",No,Binging,None,5,4,1,Yes,Not Sure,No,"Music (instrument, singing, composing, etc.), Movies, Sports / Physical Activity, looking for a gf",40,40,1,0,Coffee,None,1,0,"Science & Technology, Sports, Entertainment, Art & Culture",Linux,"Strings, Piano, Wind Instruments",8,Nike,In-N-Out,Apple,Coca Cola,Spotify,Text your parents that you will be home later,Find a group of people and talk to them,Go after hours and defend each point,Google it
11/8/2022 16:41:47,A-I,20,Female,"4'10""",No,"Hispanic, Latino or Spanish Origin",2nd generation,3,2,2,2,2,Southern California,Junior,No,Computer Engineering,3.0 - 3.49,12,139.5,CS111,AP Calculus BC,No,4,Middle School or earlier,No,,A,A,Hardware,Hardware,1st generation (first to attend),High school,Passion,No,Paper & Pen,Most of the time (51% - 99%),5,5,4,Okay with participating in class if it is a requirement,4,1,,,,No,N/A,No,N/A,Yes,No,Less than 50k,,Off-Campus (4-30 mile radius),Drive Yourself,No,1,"Entrees, Snacks, Soda",Not hungry,0,,,,,,,3,,2,0,7,3,8,0,0,,,Yes,1,3,6-8,3,,,,N/A,,,Democratic,3,3,3,Not Sure,Not Sure,Not Sure,"Movies, Board Games / Card Games",,,1,1,Soda,None,0,,,No preference,None,,No Preference,No Preference,Apple,Coca Cola,No Preference,Text your parents that you will be home later,Wait until someone approaches you,Go after hours and defend each point,Look in Textbook
11/8/2022 20:03:00,J-R,22,Male,"5'8""",Yes,Asian,1st generation,2,1,2,1,2,Southern California,Senior,No,Computational Math,3.0 - 3.49,12,165,CS105,AP Calculus AB,Yes,3,Middle School or earlier,No,none,A,A,Data Science,Data Science,1st generation (first to attend),Masters,Status,Yes,Paper & Pen,Most of the time (51% - 99%),9,9,2,"Anxious about getting judged by your peers for an incorrect answer or “bad” question, Okay with participating in class if it is a requirement",3,2,7,10,N/A,No,N/A,No,0,Yes,Yes,50k - 150k,80k,Off-Campus (4-30 mile radius),Drive Yourself,No,1,Entrees,Financial issues,2,none,2,0,2,No,Tennis,2,10,2,0,10,2,10,6,6,"FPS, Single Player Games, Battle Royale",Melee,Yes,1,2,7,4,5,Less than a week ago,Self agony,N/A,No,Games,Democratic,4,3,3,Not Sure,Not Sure,Yes,"Video Games, Sports / Physical Activity",6,7,1,0,Coffee,None,0,3,"General News & Current Affairs, Sports, Entertainment, Art & Culture",Windows,"Piano, Brass",10,Nike,In-N-Out,Apple,Sprite,Apple Music,Start heading home immediately,Find another person in same situation,Your self-confidence tanks,Look in Textbook
11/8/2022 20:29:19,A-I,22,Male,6’3”,No,Asian,1st generation,2,1,2,1,2,Southern California,Senior,No,CSBA,3.0 - 3.49,12,195,CS111,"AP Comp Sci A, AP Statistics, AP Calculus AB, AP Calculus BC, Ap conpsci principles",Yes,2,Middle School or earlier,Yes,Java,A,A,Data Science,Data Science,2nd generation (parents attended college),PhD,Money,No,Paper & Pen,Only when necessary,7,4,3,"Afraid of public speaking, Okay with participating in class if it is a requirement",1,0,3,10,N/A,No,N/A,No,0,Yes,Yes,50k - 150k,75k,Off-Campus (4-30 mile radius),Drive Yourself,No,0,N/A,Financial issues,N/A,N/A,0,0,0,No,None,1,75,0,0,0,3,20,60,0,FPS,Valorant,Yes,0,3,60,4,4,Less than a week ago,Academics,"Food, Watching Netflix",No,Binging,Republican,3,2,2,Not Sure,Not Sure,Not Sure,"Video Games, Sports / Physical Activity",85,60,0,0,Energy Drinks,"Headaches, Increased Drowsiness",0,0,"Entertainment, general news & current affairs, sports",Windows,"Piano, Wind Instruments",1,Nike,Chipotle,Apple,Coca Cola,Spotify,Stay at the party without notifying them you will be late,Wait until someone approaches you,Go after hours and defend each point,Google it
11/8/2022 20:55:42,J-R,20,Male,,Yes,Black or African American,1st generation,2,2,English,English and Spanish (not fluent),English and Spanish ,Southern California,Junior,No,Math,3.0 - 3.49,13,138,CS111,"AP Comp Sci A, AP Statistics, AP Calculus AB, AP Calculus BC",No,3,Middle School or earlier,Yes,"Java, Python",A,A,Software,Video Game Development,2nd generation (parents attended college),Masters,"Passion, Money",No,Tablet/Pen,Every time (100%),6,4,4,"Okay with participating in class if it is a requirement, Enjoy contributing to class discussion",2,0.5,6,16,1 internship in Summer 2022,No,N/A,No,N/A,Yes,No,50k - 150k,"at least $100,000",On Campus,Walk,Yes,5,Entrees,There aren't really good salad options on campus,2 Clubs: ACM and CCC (Competitive Coding Club),2,2,2,2,No,,4,10,2,1,10,3,8 (This is where most of my social media consumption comes from if Youtube is considered one),4,0,"MOBA, Fighting Games, Single Player Games, Co-op Games",League of Legends,Yes,at least 24 hours,4,8,2,1,Less than a week ago,Love Life,Food,Yes,Friends & Family,Democratic,3,2,1,Not Sure,Not Sure,Not Sure,"Music (instrument, singing, composing, etc.), Learning a language, Movies, Video Games, Board Games / Card Games, Cooking",12,8,0,0,None,None,0,1," Entertainment, Art & Culture/ Computers, Science & Technology/ General News & Current Affairs(global or local)/","Mac for Laptop, Windows for desktop","Percussion, Wind Instruments",12,Adidas,No Preference,Apple,Sprite,Spotify,Text your parents that you will be home later,Find another person in same situation,Take the criticism and think about the issues,Ask a classmate/friend
11/9/2022 8:49:41,S-Z,22,Male,"5'8""",Yes,Asian,2nd generation,1,1,3,1,2,Southern California,Senior,No,Computer Science,2.5 - 2.99,17,205,CS111,AP Statistics,Yes,5,Middle School or earlier,No,,A,A,Software,Video Game Development,1st generation (first to attend),High school,"Passion, Money",No,Tablet/Pen,Most of the time (51% - 99%),10,8,4,,5,0,15,15,"2 Offers in Fall 2019
1 Offer in Fall 2022",Yes,On campus,No,18,Yes,Yes,Less than 50k,80000,Off-Campus (4-30 mile radius),Drive Yourself,No,3,"Snacks, Juice/Tea/Coffee",Financial issues,2,0,2,0,4,No,"Soccer, Volleyball, American Football",5,10,5 +,5 +,8,5,6,15,5,"FPS, Single Player Games, MMORPG, Co-op Games",Overwatch,Yes,1,5,6,4,5,Less than a week ago,Academics,Watching Netflix,Yes,Friends & Family,Democratic,5,3,4,Yes,Yes,Yes,"Visual Arts (painting, drawing, knitting, etc.), Performing Arts (dancing, acting, etc.), Reading, Movies, Video Games, Board Games / Card Games, Cooking, Sports / Physical Activity",12,6,3,0,Coffee,Headaches,1,2,"Sports, General News & Current Affairs, Business",Windows,None,,Nike,McDonalds,Apple,Pepsi,Spotify,Text your parents that you will be home later,Find another person in same situation,Go after hours and defend each point,Ask a TA and/or professor
11/9/2022 9:36:56,J-R,22,Male,6’3’’,No,Mixed,1st generation,2,3,1,1,1,Southern California,Senior,Yes,Computer Science,3.5 - 4.0,16,A lot,CS164,"AP Comp Sci A, AP Calculus BC",Yes,5,After High School,Yes,Java,A,A,Algorithms,Mobile Development,3rd generation (grandparents attended college),Masters,Money,Yes,Paper & Pen,Only when necessary,11,7,5,Enjoy contributing to class discussion,4,2,15,15,1 Summer 22,No,N/A,No,0,No,Yes,More than 150k,100000,Off-Campus (4-30 mile radius),Drive Yourself,No,4,"Entrees, Snacks, Juice/Tea/Coffee",Financial issues,0,0,0,0,0,No,"Baseball, Soccer, Volleyball, Hockey",4,40,5 +,1,5,3,20,5,0,"MMORPG, Battle Royale",Fortnite,Yes,2,4,6,4,5,Been a while,Self agony,N/A,No,I’m strong-minded,Republican,1,2,5,Not Sure,No,No,"Movies, Video Games, Cooking, Sports / Physical Activity",20,15,2.5,2.5,Coffee,"Headaches, Increased Drowsiness",1,5,Sports/General News/Computers,MacOS,Brass,3,Vans,In-N-Out,Apple,Coca Cola,Spotify,Your parents don’t set curfews,Find a group of people and talk to them,Take the criticism and think about the issues,Ask a classmate/friend
11/9/2022 9:42:24,J-R,24,Male,"5'10""",No,Asian,Native,1,1,1,1,1,Northern California,Junior,Yes,Data Science,0 - 1.49,17,17,CS105,"AP Statistics, AP Calculus AB",Yes,3,Middle School or earlier,No,,C,B,Data Science,Video Game Development,2nd generation (parents attended college),Bachelors,Passion,Yes,Tablet/Pen,Only when necessary,10,7,1,"Afraid of public speaking, Anxious about getting judged by your peers for an incorrect answer or “bad” question",1,0,28,28,N/A,No,N/A,No,0,Yes,Yes,50k - 150k,"$75,000",On Campus,Walk,Yes,1,"Snacks, Soda",Financial issues,1,0,1,0,1,No,,1,18,3,3,28,2,28,28,28,"MOBA, FPS, Fighting Games, Gatcha, Single Player Games, MMORPG, Co-op Games, Rhythm Games, Battle Royale, RTS, Phone Games",League of Legends,No,0,1,6,4,3,Less than a week ago,Academics,Food,Yes,Friends & Family,Democratic,3,3,4,Not Sure,Not Sure,Yes,Video Games,42,14,0,0,Soda,None,0,2,"General News & Current Affairs(global or local), Entertainment, Art & Culture, Computers, Science & Technology",Windows,Piano,16,Adidas,In-N-Out,Apple,Sprite,No Preference,Your parents don’t set curfews,Go home,Your self-confidence tanks,Google it
11/9/2022 10:12:39,J-R,21,Non-binary/non-conforming,6'1,No,Asian,1st generation,3,1,1,1,1,Southern California,Senior,No,Computer Science,3.0 - 3.49,16,180,CS105,"AP Comp Sci A, AP Calculus AB",No,3,3rd/4th year of High School,Yes,"Java, C#",A,B,Software,Web Development,1st generation (first to attend),High school,"Passion, Money",No,Tablet/Pen,Only when necessary,7,4,2,"Afraid of public speaking, Anxious about getting judged by your peers for an incorrect answer or “bad” question",3,0,3,5,N/A,Yes,Off Campus,No,1.5,Yes,Yes,Less than 50k,80000,Off-Campus (3-mile radius),Walk,No,4,Entrees,Prefer cooking/packing,2,0,1,0,9,Yes,N/A,3,10,2,0,12,2,30,10,0,"MOBA, FPS, Fighting Games, Single Player Games",Fire Emblem,Yes,10,3,7,3,4,Less than a month ago,Love Life,Food,Yes,Friends & Family,Left Wing,5,5,5,Yes,Yes,Yes,"Visual Arts (painting, drawing, knitting, etc.), Video Games, Sports / Physical Activity",50,15,2,1,Coffee,None,0,4,"Art & Culture/ Computers, Science & Technology/ General News & Current Affairs(global or local), Sports",Windows,Piano,1,Converse,In-N-Out,Apple,Sprite,Spotify,Stay at the party without notifying them you will be late,Find another person in same situation,Take the criticism and think about the issues,Google it
11/9/2022 14:14:47,A-I,30,Male,"5'11""",No,White,3rd generation or more,2,Middle,1,1,1,Southern California,Senior,Yes,Computer Science,3.5 - 4.0,12,60,CS105,,Yes,5,After High School,No,,A,A,Algorithms,Machine Learning,1st generation (first to attend),High school,"Passion, Money, Career Outlook",No,Tablet/Pen,Every time (100%),7,7,3,Participating in class keeps me engaged,5,1,8,4,,Yes,On campus,Yes,9,Yes,Yes,50k - 150k,150000,Off-Campus (4-30 mile radius),Drive Yourself,No,1,Entrees,Lack of options,1,1,0,0,0,No,"Basketball, Baseball, Soccer, American Football, Cross Country, Track & Field",4,8,1,0,1,3,3,4,0,"Single Player Games, MMORPG, Co-op Games, RTS",Skyrim,Yes,,4,7,3,2,Been a while,,,,,Independent,4,3,5,Yes,Not Sure,Yes,"Reading, Video Games, Board Games / Card Games",25,5,1,1,Coffee,,No,8,"Finance, Technology, Politics",No preference,None,,saucony,Del Taco,Apple,None,Spotify,Stay at the party without notifying them you will be late,Find a group of people and talk to them,Take the criticism and think about the issues,Google it
11/9/2022 17:16:16,J-R,23,Male,6’0‘’,No,Asian,3rd generation or more,0,1,2,2,2,Out of State (Within U.S),Senior,Yes,csba,2.5 - 2.99,12,90,CS105,"AP Statistics, AP Calculus AB, AP Calculus BC",Yes,5,Middle School or earlier,No,Java,A,A,Software,Mobile Development,1st generation (first to attend),High school,Money,No,Tablet/Pen,Only when necessary,6,4,5,Enjoy contributing to class discussion,3,2,20,15,N/A,No,N/A,No,0,Yes,No,50k - 150k,2000,Off-Campus (4-30 mile radius),Drive Yourself,No,5,Entrees,Lack of options,0,0,0,0,0,No,0,3,20,1,0,3,5,10,10,0,"MOBA, MMORPG",Lost ark,No,0,3,6,3,3,Less than a month ago,Love Life,Alcohol/Drugs,No,Friends & Family,None,5,1,5,Not Sure,Not Sure,Not Sure,"Video Games, Board Games / Card Games",20,20,2,0,Coffee,Increased Anxiety,yes 2,2,cs entertainment,Windows,None,,No Preference,No Preference,No Preference,No Preference,SoundCloud ,Text your parents that you will be home later,Find a group of people and talk to them,Go after hours and defend each point,Google it
